{
  "$schema":"https://json-schema.org/draft/2020-12/schema","$id":"https://warden-drydock.invalid/contracts/hosted/v1/live.schema.json","title":"Live session, capture, replay, and overlay contracts v1","x-invariants":["live_revision_pinning","live_device_replay","live_end_barrier"],
  "$defs":{"id":{"type":"string","minLength":3,"maxLength":80,"pattern":"^[a-z][a-z0-9]*(?:_[a-z0-9]+)*$"},"digest":{"type":"string","pattern":"^[a-f0-9]{64}$"},"event":{"oneOf":[{"type":"object","required":["event_id","event_type","device_id","operation_id","device_order","payload_digest","base_revision","grounding_eligible"],"additionalProperties":false,"properties":{"event_id":{"$ref":"#/$defs/id"},"event_type":{"const":"confirmed_fact"},"device_id":{"$ref":"#/$defs/id"},"operation_id":{"$ref":"#/$defs/id"},"device_order":{"type":"integer","minimum":1},"payload_digest":{"$ref":"#/$defs/digest"},"base_revision":{"$ref":"#/$defs/id"},"grounding_eligible":{"const":true}}},{"type":"object","required":["event_id","event_type","device_id","operation_id","device_order","payload_digest","base_revision","grounding_eligible"],"additionalProperties":false,"properties":{"event_id":{"$ref":"#/$defs/id"},"event_type":{"enum":["unresolved_question","end_intent"]},"device_id":{"$ref":"#/$defs/id"},"operation_id":{"$ref":"#/$defs/id"},"device_order":{"type":"integer","minimum":1},"payload_digest":{"$ref":"#/$defs/digest"},"base_revision":{"$ref":"#/$defs/id"},"grounding_eligible":{"const":false}}}]}},
  "type":"object","required":["contract_name","contract_version","session_id","campaign_id","base_revision","reported_head_revision","workflow_version","controller","mode","events","acknowledgements","end_barrier","overlay"],"additionalProperties":false,
  "properties":{"contract_name":{"const":"live_session"},"contract_version":{"const":1},"session_id":{"$ref":"#/$defs/id"},"campaign_id":{"$ref":"#/$defs/id"},"base_revision":{"$ref":"#/$defs/id"},"reported_head_revision":{"$ref":"#/$defs/id"},"workflow_version":{"type":"integer","minimum":1},"controller":{"type":"object","required":["epoch","mode"],"additionalProperties":false,"properties":{"epoch":{"type":"integer","minimum":1},"mode":{"enum":["controller","observer","takeover_required"]}}},"mode":{"enum":["active","ended_review_pending","ended"]},"events":{"type":"array","uniqueItems":true,"items":{"$ref":"#/$defs/event"}},"acknowledgements":{"type":"array","items":{"type":"object","required":["device_id","operation_id","payload_digest","outcome"],"additionalProperties":false,"properties":{"device_id":{"$ref":"#/$defs/id"},"operation_id":{"$ref":"#/$defs/id"},"payload_digest":{"$ref":"#/$defs/digest"},"outcome":{"enum":["accepted","exact_replay","digest_conflict"]}}}},"end_barrier":{"type":"object","required":["end_operation_id","accepted_operation_ids","ready_for_proposal"],"additionalProperties":false,"properties":{"end_operation_id":{"$ref":"#/$defs/id"},"accepted_operation_ids":{"type":"array","uniqueItems":true,"items":{"$ref":"#/$defs/id"}},"ready_for_proposal":{"type":"boolean"}}},"overlay":{"type":"object","required":["overlay_id","authority","base_revision","confirmed_fact_ids","question_ids"],"additionalProperties":false,"properties":{"overlay_id":{"$ref":"#/$defs/id"},"authority":{"const":"non_canon"},"base_revision":{"$ref":"#/$defs/id"},"confirmed_fact_ids":{"type":"array","uniqueItems":true,"items":{"$ref":"#/$defs/id"}},"question_ids":{"type":"array","uniqueItems":true,"items":{"$ref":"#/$defs/id"}}}}}
}
