{
  "contract_name": "live_session",
  "contract_version": 1,
  "session_id": "session_alpha",
  "campaign_id": "campaign_alpha",
  "base_revision": "revision_12",
  "reported_head_revision": "revision_13",
  "workflow_version": 3,
  "controller": {"epoch": 2, "mode": "controller"},
  "mode": "ended_review_pending",
  "events": [
    {"event_id":"event_fact","event_type":"confirmed_fact","device_id":"device_alpha","operation_id":"operation_fact","device_order":1,"payload_digest":"aaaaaaaaaaaaaaaaaaaaaaaaaaaaaaaaaaaaaaaaaaaaaaaaaaaaaaaaaaaaaaaa","base_revision":"revision_12","grounding_eligible":true},
    {"event_id":"event_question","event_type":"unresolved_question","device_id":"device_alpha","operation_id":"operation_question","device_order":2,"payload_digest":"bbbbbbbbbbbbbbbbbbbbbbbbbbbbbbbbbbbbbbbbbbbbbbbbbbbbbbbbbbbbbbbb","base_revision":"revision_12","grounding_eligible":false},
    {"event_id":"event_end","event_type":"end_intent","device_id":"device_alpha","operation_id":"operation_end","device_order":3,"payload_digest":"cccccccccccccccccccccccccccccccccccccccccccccccccccccccccccccccc","base_revision":"revision_12","grounding_eligible":false}
  ],
  "acknowledgements": [
    {"device_id":"device_alpha","operation_id":"operation_fact","payload_digest":"aaaaaaaaaaaaaaaaaaaaaaaaaaaaaaaaaaaaaaaaaaaaaaaaaaaaaaaaaaaaaaaa","outcome":"accepted"},
    {"device_id":"device_alpha","operation_id":"operation_question","payload_digest":"bbbbbbbbbbbbbbbbbbbbbbbbbbbbbbbbbbbbbbbbbbbbbbbbbbbbbbbbbbbbbbbb","outcome":"accepted"},
    {"device_id":"device_alpha","operation_id":"operation_end","payload_digest":"cccccccccccccccccccccccccccccccccccccccccccccccccccccccccccccccc","outcome":"accepted"}
  ],
  "end_barrier": {"end_operation_id":"operation_end","accepted_operation_ids":["operation_fact","operation_question"],"ready_for_proposal":true},
  "overlay": {"overlay_id":"overlay_alpha","authority":"non_canon","base_revision":"revision_12","confirmed_fact_ids":["event_fact"],"question_ids":["event_question"]}
}
